,会社名,雇用形態
0,KUROFUNE＆PARTNERS株式会社 ,正社員
1,NITOH株式会社 ,正社員
2,ソフトバンク営業職合同募集 ,正社員
3,UTエイム株式会社 ,正社員
4,UTエイム株式会社 ,正社員
5,UTエイム株式会社 ,正社員
6,株式会社アクアライン ,正社員
7,株式会社ライジングサンセキュリティーサービス ,正社員
8,株式会社ジーアフター ,正社員
9,インターギアソリューション株式会社 ,業務委託
10,HITOWAライフパートナー株式会社 ,FCオーナー
11,株式会社ビッグモーター ,正社員
12,株式会社プレサンスコーポレーション ,正社員
13,株式会社PE-BANK ,業務委託
14,株式会社ライジングサンセキュリティーサービス ,正社員
15,ロイヤルハウジング株式会社 ,正社員
16,インターギアソリューション株式会社 ,業務委託
17,株式会社フレックス ,正社員
18,株式会社モリシン電気設備 ,正社員
19,株式会社修優舘 ,正社員
20,KUROFUNE＆PARTNERS株式会社 ,正社員
21,エスリード株式会社 ,正社員
22,大基興業有限会社 ,正社員
23,株式会社サカイ引越センター ,正社員
24,株式会社アール・エム ,正社員
25,株式会社フレックス ,正社員
26,株式会社インヴァランス ,正社員
27,大同生命保険株式会社 ,正社員
28,株式会社ハンナ ,正社員
29,株式会社フレックス ,正社員
30,株式会社サンディ ,正社員
31,創建プランニング株式会社 ,正社員
32,株式会社HiiizL ,正社員
33,株式会社NST ,正社員
34,株式会社ビッグモーター ,正社員
35,東京エムケイ株式会社 ,正社員
36,株式会社ヤマダホールディングス ,契約社員
37,株式会社ヤマダホールディングス ,契約社員
38,株式会社グランレブリー ,正社員
39,UTエイム株式会社 ,正社員
40,株式会社ビッグモーター ,正社員
41,株式会社あいらいふ ,正社員
42,UTエイム株式会社 ,正社員
43,三井住友トラスト不動産株式会社 ,正社員
44,株式会社貴順 ,業務委託
45,株式会社エムピーキッチン ,正社員
46,サングローブ株式会社 ,正社員
47,株式会社free mova,正社員
48,株式会社ビッグモーター ,正社員
49,株式会社T-TOP ,正社員
50,JTA株式会社 ,正社員
51,株式会社優誠 ,正社員
52,株式会社アイダ設計 ,正社員
53,株式会社タウンハウジング ,正社員
54,株式会社ビッグモーター ,正社員
55,株式会社アウトソーシングテクノロジー ,正社員
56,株式会社ビッグモーター ,正社員
57,株式会社ビッグモーター ,正社員
58,株式会社ユタカホーム ,正社員
59,UTエイム株式会社 ,正社員
60,株式会社花山工務店 ,正社員
61,株式会社ビッグモーター ,正社員
62,株式会社綜合キャリアオプション ,正社員
63,エーアイアールグループ合同募集 ,正社員
64,株式会社サニックス ,正社員
65,株式会社PGSホーム ,正社員
66,株式会社ライジングサンセキュリティーサービス ,正社員
67,株式会社エー・エス・エル ,正社員
68,DSP株式会社 ,正社員
69,株式会社PGSホーム ,正社員
70,KUROFUNE＆PARTNERS株式会社 ,正社員
71,UTエイム株式会社 ,正社員
72,株式会社アサンテ ,正社員
73,株式会社アキュラホーム ,正社員
74,株式会社誠進堂 ,正社員
75,株式会社アキュラホーム,正社員
76,株式会社そら ,正社員
77,日研トータルソーシング株式会社 ,正社員
78,株式会社ミュゼプラチナム ,正社員
79,UTコンストラクション株式会社 ,正社員
80,日研トータルソーシング株式会社 ,正社員
81,株式会社 High mind ,正社員
82,株式会社アイエスエフネット ,正社員
83,株式会社コシダカ ,正社員
84,株式会社コシダカ ,正社員
85,DSP株式会社 ,正社員
86,株式会社ハマエンジニアリング ,正社員
87,株式会社ビッグモーター ,正社員
88,株式会社コシダカ ,正社員
89,株式会社アイエスエフネット ,正社員
90,株式会社コシダカ ,正社員
91,株式会社アイエスエフネット ,正社員
92,DSP株式会社 ,正社員
93,株式会社ビッグモーター ,正社員
94,株式会社ビッグモーター ,正社員
95,株式会社メディオテクノ ,正社員
96,株式会社イー・トラスト ,正社員
97,株式会社山崎機械店 ,正社員
98,センコー株式会社 ,正社員
99,株式会社リロパートナーズ ,正社員
100,インターギアソリューション株式会社 ,業務委託
101,エフエルシープレミアム株式会社 ,正社員
102,益三建設株式会社 ,正社員
103,有限会社グリーンアンドハウス ,正社員
104,大阪第一交通株式会社 ,正社員
105,株式会社グラスト ,正社員
106,株式会社エージェントゲート ,正社員
107,株式会社アーキ・ジャパン ,正社員
108,東京エムケイ株式会社 ,正社員
109,株式会社HIPOWER ,正社員
110,株式会社エージェントゲート ,正社員
111,株式会社テイクス ,正社員
112,株式会社インターレイズ ,正社員
113,株式会社エージェントゲート ,正社員
114,株式会社ネオキャリア ,正社員
115,株式会社建築資料研究社 ,正社員
116,株式会社テイクス ,正社員
117,株式会社アミ―クス ,FCオーナー
118,株式会社ラビット・カーネットワーク ,正社員
119,株式会社一条工務店 ,正社員
120,UTエイム株式会社 ,正社員
121,株式会社九州エネコ ,正社員
122,東建コーポレーション株式会社 ,正社員
123,東建コーポレーション株式会社 ,正社員
124,ヒカリ電気土木株式会社 ,正社員
125,株式会社テクトン ,正社員
126,東建コーポレーション株式会社 ,正社員
127,日本eリモデル株式会社 ,正社員
128,株式会社ゴールドファステート ,正社員
129,UTエイム株式会社 ,正社員
130,光電気工事株式会社 ,正社員
131,株式会社近畿住宅流通 ,正社員
132,UTエイム株式会社 ,正社員
133,UTコンストラクション株式会社 ,正社員
134,小金井不動産株式会社 ,正社員
135,東建コーポレーション株式会社 ,正社員
136,株式会社アドレア ,契約社員
137,株式会社ワールドコーポレーション ,正社員
138,大和総合住設株式会社 ,正社員
139,株式会社ネオ・コーポレーション ,正社員
140,株式会社ワールドコーポレーション,正社員
141,株式会社ワールドコーポレーション ,正社員
142,メットライフ生命保険株式会社 ,正社員
143,株式会社レアリス ,正社員
144,株式会社砂建 ,正社員
145,日本交通株式会社 ,正社員
146,株式会社ホームワン ,正社員
147,株式会社セントラルアセット ,正社員
148,株式会社大成社 ,正社員
149,株式会社あきんどスシロー ,正社員
150,ヴェル・ハウジング株式会社 ,正社員
151,クラウンコンサルティング株式会社 ,正社員
152,メットライフ生命保険株式会社 ,正社員
153,株式会社センス ,正社員
154,株式会社エストゥルース ,正社員
155,JCSロジスコ株式会社 ,業務委託
156,株式会社トライトキャリア ,正社員
157,株式会社REGALE ,正社員
158,株式会社ジーアフター ,正社員
159,ソフトバンク営業職合同募集 ,正社員
160,株式会社ドリームホーム ,正社員
161,イッセイコンサルタント株式会社 ,正社員
162,居藏管工株式会社 ,正社員
163,ソフトバンク営業職合同募集 ,正社員
164,株式会社ゼディアルーク ,正社員
165,株式会社建築資料研究社 ,正社員
166,小金井不動産株式会社 ,正社員
167,株式会社阿部技建 ,正社員
168,エムケイ株式会社 ,正社員
169,株式会社ガリレオコーポレーション ,正社員
170,高松建設株式会社 ,正社員
171,積水ハウス不動産関西株式会社 ,正社員
172,株式会社手なおし屋 ,正社員
173,アップライブステージ株式会社 ,正社員
174,クルーガーグループ株式会社 ,正社員
175,株式会社グランデ ,正社員
176,株式会社エコ・エー ,正社員
177,ディーピーティー株式会社 ,正社員
178,株式会社グッドワークコミュニケーションズ ,正社員
179,株式会社グランド1コーポレーション ,正社員
180,株式会社祥福企画 ,正社員
181,株式会社リンクスタッフグループ ,正社員
182,日本セキュリティ株式会社 ,正社員
183,株式会社ウィザースホーム ,正社員
184,株式会社Freedoming ,正社員
185,大和総合住設株式会社 ,正社員
186,東宝ホーム株式会社 ,正社員
187,株式会社FGGコーポレーション ,正社員
188,株式会社ビルドイット ,正社員
189,株式会社エクストリンク ,正社員
190,株式会社FGGコーポレーション ,正社員
191,クレストジャパン株式会社 ,正社員
192,エコトラスト株式会社 ,正社員
193,Y&I Group株式会社 ,正社員
194,日本交通株式会社 ,正社員
195,アートバンライン株式会社 ,正社員
196,アートバンライン株式会社 ,正社員
197,アートバンライン株式会社 ,正社員
198,木下工業株式会社 ,正社員
199,幸信電気株式会社 ,正社員
200,株式会社H.I.T WORLD ,正社員
201,楽天モバイル株式会社 ,契約社員
202,株式会社ソヴリックコーポレーション ,正社員
203,ブロードマインド株式会社 ,正社員
204,さか電工株式会社 ,正社員
205,株式会社comam ,正社員
206,可児建設株式会社 ,正社員
207,有限会社エフォール ,業務委託
208,日本建物株式会社 ,正社員
209,倉一建基株式会社 ,正社員
210,Rセキュリティ株式会社 ,正社員
211,株式会社LUXSIA ,正社員
212,株式会社サーバントップ ,正社員
213,GMO TECH株式会社 ,正社員
214,メットライフ生命保険株式会社 ,正社員
215,株式会社ブッシュクロフィード ,正社員
216,株式会社アドヴァンス ,正社員
217,有限会社アイユーホーム ,正社員
218,Garrett Japan合同会社 ,契約社員
219,株式会社総合資格 ,正社員
220,株式会社ブッシュクロフィード ,正社員
221,株式会社日栄テック ,正社員
222,株式会社メイズ ,正社員
223,株式会社ナチュレカード ,業務委託
224,株式会社HI-LINE ,正社員
225,ＬＵＣＩＯＮ＆Ｃｏｍｐａｎｙ株式会社 ,正社員
226,東京経済株式会社 ,正社員
227,株式会社CREA HOME ,正社員
228,株式会社ヨドバシカメラ ,正社員
229,クリーンデバイス・テクノロジー株式会社,FCオーナー
230,日本テンポラリーハウス株式会社 ,正社員
231,エントロス株式会社 ,正社員
232,株式会社前平電機 ,正社員
233,株式会社京進 ,契約社員
234,レイス株式会社 ,正社員
235,レイス株式会社 ,正社員
236,株式会社ワンダー ,正社員
237,株式会社LTCパートナーズ ,正社員
238,株式会社UPSTART ,正社員
239,株式会社マイホーム ,正社員
240,フジミハウジング株式会社 ,正社員
241,株式会社マリオットバケーションクラブインターナショナル,契約社員
242,株式会社マリオットバケーションクラブインターナショナル,契約社員
243,株式会社窪治組 ,正社員
244,株式会社松陰会舘 ,正社員
245,リアルティ株式会社 ,正社員
246,株式会社インターレイズ ,正社員
247,株式会社京進 ,FCオーナー
248,スカイジャパン株式会社 ,正社員
249,大長産業株式会社 ,正社員
250,アパルトマンイクシーズ株式会社 ,正社員
251,株式会社テクトン ,正社員
252,丸栄産業株式会社 ,正社員
253,株式会社アイダ設計 ,正社員
254,株式会社阿部建設 ,正社員
255,積水ハウス不動産中国四国株式会社 ,正社員
256,光和電設株式会社 ,正社員
257,株式会社日本総合ビジネス ,正社員
258,株式会社アイシーイノベーション ,正社員
259,株式会社タイセイリサイクル ,正社員
260,株式会社ヨシナガ工業 ,正社員
261,株式会社浜石工務店 ,契約社員
262,株式会社フォーカスタマーズ ,正社員
263,株式会社ユースリー ,正社員
264,株式会社フットワーク ,正社員
265,株式会社ファーラウト ,正社員
266,株式会社トラスト不動産 ,正社員
267,株式会社OMY ,契約社員
268,株式会社朝日写真ニュース社 ,正社員
269,和泉地所株式会社 ,正社員
270,アパルトマンイクシーズ株式会社 ,正社員
271,朝日土地建物株式会社,正社員
272,株式会社あんしんマイホーム ,正社員
273,株式会社カクダイホーム ,正社員
274,不二装備工業株式会社 ,正社員
275,株式会社フォートップス ,正社員
276,株式会社レジット ,正社員
277,株式会社エス・エル・エス福岡 ,正社員
278,株式会社キャリアサービス ,正社員
279,四国化工建設株式会社 ,正社員
280,洋伸建設株式会社 ,正社員
281,株式会社ディークラフト ,正社員
282,株式会社メディエイド ,正社員
283,株式会社ゲッコー ,正社員
284,CPAエクセレントパートナーズ株式会社 ,正社員
285,株式会社ファースト ,正社員
286,株式会社国際技術コンサルタンツ ,正社員
287,株式会社丸八ダイレクト ,正社員
288,株式会社AMBITION ,正社員
289,アクサ生命保険株式会社 ,正社員
290,株式会社サンドリア ,正社員
291,株式会社CRUD nop ,正社員
292,株式会社ヒューマンアイズ ,正社員
293,株式会社TERASS ,業務委託
294,御幸建設株式会社 ,正社員
295,エーシー企画株式会社 ,正社員
296,株式会社日本アムスコ ,正社員
297,株式会社ほけんショップアイ ,正社員
298,株式会社大登 ,正社員
299,株式会社ヤマキ ,正社員
300,上海中和軟件有限公司 ,契約社員
301,株式会社トータル ,正社員
302,有限会社中日本物流 ,正社員
303,株式会社コプロ・エンジニアード ,正社員
304,イオンリチウムエナジー株式会社 ,正社員
305,株式会社千商 ,正社員
306,西日本高速道路エンジニアリング中国株式会社 ,正社員
307,芝浦電子工業株式会社 ,正社員
308,FUJINO HOUSE ENGINEERING株式会社 ,正社員
309,日本車輛洗滌機株式会社 ,正社員
310,株式会社カインドホーム宇都宮 ,正社員
311,鹿島フィット株式会社 ,正社員
312,株式会社A-Trus ,正社員
313,株式会社Ｍｕｓｈ－Ｒｏｏｍ ,正社員
314,株式会社キュービック ,正社員
315,株式会社ユーアイテック ,正社員
316,株式会社ステップアップ ,正社員
317,株式会社Ｆｏｒ　Ｙｏｕ　Ｃｏｎｓｕｌｔｉｎｇ ,正社員
318,株式会社日本シーマート ,正社員
319,株式会社東亜産業 ,正社員
320,タツミ電気工業株式会社 ,正社員
321,大洋建設株式会社 ,正社員
322,株式会社ポイント ,正社員
323,株式会社ヒビヤト ,正社員
324,新日本ネクステート株式会社 ,正社員
325,株式会社ルクス ,正社員
326,株式会社フィット ,正社員
327,株式会社wings ,正社員
328,株式会社ファイン ,正社員
329,株式会社ドリームジャック ,正社員
330,株式会社曙佳源 ,正社員
331,株式会社マツミ ,正社員
332,株式会社前川造園土木 ,正社員
333,東山管理センター株式会社 ,正社員
334,株式会社太田興産 ,正社員
335,株式会社めいしんグループ ,正社員
336,FUJITSU UT株式会社 ,正社員
337,株式会社大軌 ,正社員
338,株式会社ワークナビ.com ,正社員
339,株式会社海山組 ,正社員
340,松田土木工業株式会社 ,正社員
341,東葉技建株式会社 ,正社員
342,株式会社ライフエージェント ,正社員
343,冨士自動車株式会社 ,正社員
344,株式会社晃和コンサルタント ,正社員
345,三喜工業株式会社 ,正社員
346,信盛物流株式会社 ,正社員
347,株式会社今井自動車教習所 ,正社員
348,株式会社エス・ケー・アイ ,正社員
349,株式会社興徳クリーナー ,正社員
350,株式会社エイコーレンタサービス ,正社員
351,株式会社ワークステーション ,FCオーナー
352,アクティホームズ株式会社 ,正社員
353,ケイエイツー株式会社 ,正社員
354,株式会社タイセイ ,正社員
355,新日本住建株式会社 ,正社員
356,株式会社Y’S GARAGE ,正社員
357,株式会社メディカルアシスト ,正社員
358,株式会社アクト ,正社員
359,株式会社Y’S GARAGE ,正社員
360,Bigmac株式会社 ,正社員
361,株式会社東名 ,正社員
362,株式会社ARS ,正社員
363,株式会社ケーシーエス・エス ,正社員
364,株式会社SAMURAI ,正社員
365,株式会社LIV ,正社員
366,株式会社ケーシーエス ,正社員
367,株式会社エム・シー・ピー ,正社員
368,株式会社近畿サービス ,正社員
369,ロビンスジャパン株式会社 ,正社員
370,株式会社北浦板金 ,正社員
371,株式会社マリーロード ,正社員
372,ソーシャルインクルー株式会社 ,正社員
373,日本コンセントリクス株式会社 ,契約社員
374,株式会社関塾 ,正社員
375,株式会社コンセプト ,正社員
376,株式会社エフテック ,正社員
377,株式会社小山電機工事 ,正社員
378,株式会社リクルート北関東マーケティング ,正社員
379,株式会社大通 ,正社員
380,鶴ホーム株式会社 ,正社員
381,株式会社ホワイトライン ,正社員
382,株式会社倉嶋自動車商会 ,正社員
383,株式会社ユニヴィスコンサルティング ,正社員
384,株式会社川村インターナショナル ,正社員
385,株式会社エフ・アール・エス ,正社員
386,株式会社ワイズ高橋 ,正社員
387,タウンクロス株式会社 ,正社員
388,株式会社司興業 ,正社員
389,有限会社ヤマテック ,正社員
390,nts株式会社 ,正社員
391,株式会社大黒屋 ,正社員
392,株式会社エーライド ,正社員
393,株式会社ヴェス ,正社員
394,株式会社福岡地行 ,正社員
395,株式会社フリーテンポ ,正社員
396,株式会社鶴電工業 ,正社員
397,株式会社エールホーム ,正社員
398,株式会社清光社 ,正社員
399,株式会社メイプルリビングサービス ,正社員
400,株式会社逢慈 ,正社員
401,蒼翠税理士法人 ,正社員
402,株式会社ビズアップ総研 ,正社員
403,株式会社沖縄ユーポス ,正社員
404,株式会社ミナカミ ,正社員
405,有限会社コウチョウ運輸 ,正社員
406,株式会社環境設備 ,正社員
407,アキバネクサス株式会社 ,業務委託
408,株式会社EnjoyLifeCompany ,正社員
409,株式会社ストラテジックディシジョン ,正社員
410,昭和エンジニアリング株式会社 ,契約社員
411,株式会社建築資料研究社 ,正社員
412,株式会社サンプラン ,正社員
413,株式会社グッピーズ ,正社員
414,東北YKホーム株式会社 ,正社員
415,グラングッド不動産株式会社 ,正社員
416,関東総合設備工事株式会社 ,正社員
417,株式会社渡辺組 ,正社員
418,株式会社AZEAL BRANDING ,正社員
419,株式会社ＩＢＪ ,正社員
420,株式会社アビックスコーポレーション ,正社員
421,株式会社ホンダクリオ南海 ,正社員
422,株式会社ベストホーム ,正社員
423,ONODA株式会社 ,正社員
424,株式会社Vヴィズリア ,正社員
425,株式会社Life Next ,正社員
426,株式会社丸二製作所 ,正社員
427,株式会社プログランス ,正社員
428,株式会社Forward ,業務委託
429,株式会社有藤商店 ,正社員
430,アクリーコンサルティング株式会社 ,正社員
431,I-PEX株式会社 ,正社員
432,コスモコントロール株式会社 ,正社員
433,株式会社ＴＨＲＥＥ ,正社員
434,大賀建設株式会社 ,正社員
435,三重機械鉄工株式会社 ,正社員
436,京和ブロンズ株式会社 ,正社員
437,株式会社マツミ ,正社員
438,株式会社西家 ,正社員
439,有限会社日詰電業 ,正社員
440,株式会社タイセイ ,正社員
441,アジア熱処理技研株式会社 ,正社員
442,株式会社九州冷鮮輸送 ,正社員
443,イビデン産業株式会社 ,正社員
444,株式会社レソリューション ,正社員
445,株式会社レソリューション ,正社員
446,株式会社ユーテック ,正社員
447,株式会社埼玉磐根 ,正社員
448,札幌北交ハイヤー株式会社 ,正社員
449,郡司建設株式会社 ,正社員
450,想いコーポレーション株式会社 ,正社員
451,想いコーポレーション株式会社 ,正社員
452,株式会社札幌解体建設 ,正社員
453,株式会社ヒノマル架設 ,正社員
454,カオンメディアジャパン株式会社 ,正社員
455,株式会社名光電気 ,正社員
456,株式会社中国道路施設 ,正社員
457,株式会社三矢 ,正社員
458,フルカワ工業株式会社 ,正社員
459,株式会社大平基礎 ,正社員
460,合資会社東洋電機制御 ,正社員
461,株式会社モリコーポレーション ,正社員
462,株式会社ウッドヴェル ,正社員
463,入江運輸倉庫株式会社 ,正社員
464,平安衛生開発株式会社 ,正社員
465,株式会社サン・サービス ,正社員
466,新日本リース株式会社 ,正社員
467,株式会社名神建工 ,正社員
468,若松建設株式会社 ,正社員
469,ダイケン株式会社 ,正社員
470,北摂工業株式会社 ,正社員
471,株式会社グロリアース ,正社員
472,株式会社井沢設計 ,正社員
473,株式会社Let's ,正社員
474,株式会社日本セイユ― ,正社員
475,株式会社富士鳩急送 ,正社員
476,株式会社カワテ ,正社員
477,有限会社浪速酸素商会 ,正社員
478,株式会社ヘヤミセ ,正社員
479,有限会社福岡紙業 ,正社員
480,株式会社アイプロホールディングス ,正社員
481,寺本運輸倉庫株式会社 ,正社員
482,株式会社リンクス ,正社員
483,MIGホールディングス株式会社,FCオーナー
484,株式会社サンモト ,正社員
485,株式会社ライフスタイル ,業務委託
486,株式会社KEnKI ,正社員
487,リスロン株式会社 ,業務委託
488,有限会社朝日新聞末津新聞舗 ,正社員
489,田中通信工業株式会社 ,正社員
490,株式会社ウメケン ,正社員
491,リコーテック株式会社 ,正社員
492,株式会社城西自動車学校 ,正社員
493,株式会社サンガアソシエイツ ,正社員
494,株式会社トラスト ,業務委託
495,野間ガスサービス株式会社 ,正社員
496,株式会社REAL ,業務委託
497,アイデックス株式会社 ,正社員
498,大庭社会保険労務士事務所 ,正社員
499,株式会社フリックス ,業務委託
500,富士防災警備株式会社 ,正社員
501,長田広告株式会社 ,正社員
502,新中央航空株式会社 ,正社員
503,株式会社ケミックス ,正社員
504,ケミックス東海株式会社 ,正社員
505,日進陸運株式会社 ,正社員
506,東建コーポレーション株式会社 ,正社員
507,東建コーポレーション株式会社 ,正社員
508,三ツ矢鉄工株式会社 ,正社員
509,東建コーポレーション株式会社 ,正社員
510,東建コーポレーション株式会社 ,正社員
511,東建コーポレーション株式会社 ,正社員
512,東建コーポレーション株式会社 ,正社員
513,株式会社福コンサルタント ,正社員
514,株式会社PRIME ,パート・アルバイト
515,株式会社ユキ設備 ,正社員
516,株式会社reclaim ,正社員
517,株式会社センシン ,正社員
518,日研トータルソーシング株式会社 ,正社員
519,日研トータルソーシング株式会社 ,正社員
520,日研トータルソーシング株式会社 ,正社員
521,東京海上日動あんしん生命保険株式会社 ,正社員
522,日研トータルソーシング株式会社 ,正社員
523,スリーエムホーム高知株式会社 ,正社員
524,日研トータルソーシング株式会社 ,正社員
525,株式会社スカイフィールドコーポレーション ,正社員
526,日研トータルソーシング株式会社 ,正社員
527,株式会社大濠地所 ,正社員
528,株式会社YES ,正社員
529,日研トータルソーシング株式会社 ,正社員
530,日研トータルソーシング株式会社 ,正社員
531,日研トータルソーシング株式会社 ,正社員
532,日研トータルソーシング株式会社 ,正社員
533,株式会社ウンノハウス ,正社員
534,株式会社マイプレイス ,正社員
535,株式会社ウンノハウス ,正社員
536,株式会社中央建設コンサルタント ,正社員
537,株式会社バーンフュージョン ,一般派遣
538,株式会社ウンノハウス ,正社員
539,株式会社バーンフュージョン ,契約社員
540,株式会社ウンノハウス ,正社員
541,株式会社バーンフュージョン ,契約社員
542,株式会社ウンノハウス ,正社員
543,株式会社福岡技建工業 ,正社員
544,平松電気工事株式会社 ,正社員
545,株式会社當木工事 ,正社員
546,株式会社ケンオウ ,正社員
